{
  "schema_version": "1",
  "workspace_id": "wsp_00000000000000000000000000000001",
  "runner_id": "rnr_00000000000000000000000000000001",
  "dispatch_id": "dsp_00000000000000000000000000000001",
  "attempt_id": "atm_00000000000000000000000000000001",
  "lease_epoch": "7",
  "status": "accepted",
  "type": "task.ack"
}
